{
    "URL": "https://chrome-perf-autopush.corp.goog",
    "landing_page_rel_path": "/m/",
    "header_image_url": "/dist/images/chrome-logo.svg",
    "ga_measurement_id": "G-PFC9BX9411",
    "allowed_hosts": [],
    "backend_host_url": "perf-be-chrome-non-public.perf.svc.cluster.local:8000",
    "contact": "browser-perf-engprod@google.com",
    "instance_name": "chrome-internal (Autopush)",
    "trace_sample_proportion": 0.1,
    "invalid_param_char_regex": "([^a-zA-Z0-9!~@#$%^&*()+ :\\._\\-])",
    "fetch_chrome_perf_anomalies": true,
    "use_regression2_schema": true,
    "bug_host_url": "https://issues.chromium.org",
    "feedback_url": "http://go/berf-skia-feedback",
    "chat_url": "http://go/berf-skia-chat",
    "filter_parent_traces": true,
    "notify_config": {
        "notifications": "anomalygroup"
    },
    "issue_tracker_config": {
        "notification_type": "issuetracker",
        "issue_tracker_api_key_secret_project": "skia-infra-public",
        "issue_tracker_api_key_secret_name": "perf-issue-tracker-apikey"
    },
    "auth_config": {
        "header_name": "X-WEBAUTH-USER"
    },
    "data_store_config": {
        "datastore_type": "spanner",
        "connection_string": "postgresql://root@localhost:5432/chrome_int_autopush?sslmode=disable",
        "tile_size": 8192,
        "enable_follower_reads": true,
        "min_db_connections": 5
    },
    "experiments": {
        "enable_skia_bridge_aggregation": true,
        "df_iter_trace_slicer": true,
        "regressions_trace_id_field": true
    },
    "ingestion_config": {
        "source_config": {
            "source_type": "gcs",
            "project": "skia-public",
            "topic": "perf-ingestion-chrome-internal-autopush",
            "subscription": "perf-ingestion-chrome-internal-autopush",
            "sources": [
                "gs://chrome-perf-non-public/ingest"
            ]
        },
        "branches": [],
        "file_ingestion_pubsub_topic_name": "perf-cluster-chrome-non-public-autopush"
    },
    "git_repo_config": {
        "provider": "gitiles",
        "url": "https://chromium.googlesource.com/chromium/src",
        "dir": "/tmp/checkout",
        "debounce_commit_url": false,
        "file_change_marker": "",
        "start_commit": "b7fa4587f55a066e97f79b4c97ed785dc217064b",
        "commit_number_regex": "Cr-Commit-Position: refs/heads/(main|master)@\\{#(.*)\\}"
    },
    "extra_links": {
        "name": "CBB",
        "title": "Comparative Browser Benchmarking (CBB)",
        "links": [
            {
                "text": "Mac (go/cbb-mac)",
                "href": "https://chrome-perf.corp.goog/m?begin=1752000000&end=1780000000&numCommits=50&shortcut=dd0dd339ebb06e5f01e64de82f3977d1&splitByKeys=benchmark&totalGraphs=4",
                "description": "CBB results on Mac"
            },
            {
                "text": "Windows x64 (go/cbb-win)",
                "href": "https://chrome-perf.corp.goog/m?begin=1752000000&end=1780000000&numCommits=50&shortcut=8e3d2605de2b3e17fa257ea47275ee0a&splitByKeys=benchmark&totalGraphs=4",
                "description": "CBB results on Windows (Intel CPU)"
            },
            {
                "text": "Windows ARM64 (go/cbb-win-arm)",
                "href": "https://chrome-perf.corp.goog/m?begin=1752000000&end=1780000000&numCommits=50&shortcut=1adc4014bca70f8245c3250c46ff2abc&splitByKeys=benchmark&totalGraphs=4",
                "description": "CBB results on Windows (ARM64 CPU)"
            },
            {
                "text": "Pixel Tablet (go/cbb-tangor)",
                "href": "https://chrome-perf.corp.goog/m?begin=1752000000&end=1780000000&numCommits=35&shortcut=134f1b581613f1f4bbe63b66719ff588&splitByKeys=benchmark&totalGraphs=5",
                "description": "CBB results on Pixel Tablet (Tangor)"
            },
            {
                "text": "Speedometer3 (go/cbb-sp3)",
                "href": "https://chrome-perf.corp.goog/m?begin=1752000000&end=1780000000&numCommits=50&shortcut=7bd8bba5abb81582cffb5cb8578011b2&splitByKeys=bot&totalGraphs=4",
                "description": "CBB Speedometer3 results"
            },
            {
                "text": "JetStream2 (go/cbb-js2)",
                "href": "https://chrome-perf.corp.goog/m?begin=1752000000&end=1780000000&numCommits=50&shortcut=c68938c0463f91bfc8b1e9a8aca18499&splitByKeys=bot&totalGraphs=4",
                "description": "CBB JetStream2 results"
            },
            {
                "text": "JetStream3 (go/cbb-js3)",
                "href": "https://chrome-perf.corp.goog/m?begin=1752000000&end=1780000000&numCommits=50&shortcut=996f59da14c437bbef118c9514ea4724&splitByKeys=bot&totalGraphs=4",
                "description": "CBB JetStream3 results"
            },
            {
                "text": "MotionMark (go/cbb-mm)",
                "href": "https://chrome-perf.corp.goog/m?begin=1752000000&end=1780000000&numCommits=50&shortcut=598f56484c8e1602be056849b115e0b8&splitByKeys=bot&totalGraphs=4",
                "description": "CBB MotionMark results"
            },
            {
                "text": "Loadline 2 (go/cbb-ll)",
                "href": "https://chrome-perf.corp.goog/m/?begin=1752000000&end=1780000000&numCommits=20&shortcut=3d5e9ef84f6673ca273c3cabb4297113&totalGraphs=1",
                "description": "CBB Loadline 2 results (Android only)"
            },
            {
                "text": "Overall results (go/cbb-all)",
                "href": "https://chrome-perf.corp.goog/m?begin=1752000000&end=1780000000&numCommits=50&shortcut=81ad17a19b621a127443d95ffe7e28b3&splitByKeys=benchmark&totalGraphs=5",
                "description": "CBB results for all benchmarks and platforms"
            }
        ]
    },
    "query_config": {
        "include_params": [
            "benchmark",
            "bot",
            "test",
            "subtest_1",
            "subtest_2",
            "subtest_3"
        ],
        "default_param_selections": {
            "stat": ["value"]
        },
        "default_url_values": {
            "plotSummary": "true",
            "useTestPicker": "true",
            "showZero": "false",
            "enable_chart_tooltip": "true",
            "use_titles": "true",
            "show_google_plot": "true"
        },
        "default_range": 604800,
        "cache_config": {
            "type": "redis",
            "level1_cache_key": "benchmark",
            "level2_cache_key": "bot",
            "enabled": true
        },
        "redis_config": {
            "project": "skia-infra-corp",
            "zone": "us-central1",
            "instance": "chrome-internal",
            "cache_expiration_minutes": 300
        }
    },
    "data_point_config": {
        "keys_for_commit_range": ["V8", "WebRTC", "V8 Git Hash", "WebRTC Git Hash"],
        "keys_for_useful_links": [
            "Build Page", "Tracing uri", "Browser Version", "Workflow", "Swarming Tasks"],
        "skip_commit_detail_display": true,
        "show_json_file_display": false
    },
    "temporal_config": {
        "host_port": "temporal.temporal:7233",
        "namespace": "perf-internal",
        "grouping_task_queue": "perf.perf-chrome-internal.grouping",
        "pinpoint_task_queue": "perf.perf-chrome-public.bisect"
    },
    "enable_sheriff_config": true,
    "help_url_override": "http://go/chrome-perf-user-doc",
    "trace_format": "chrome",
    "need_alert_action": true,
    "optimize_sqltracestore": true,
    "new_alerts_page": true,
    "show_triage_link": false,
    "show_bisect_btn": true,
    "show_hash_ranges_in_tooltip": false,
    "allow_multiple_regressions_per_alert_id": true
}
